{
  "specversion": "1.0",
  "id": "evt_orion_001",
  "source": "orion",
  "type": "ocn.orion.explanation.v1",
  "subject": "opt_12345",
  "time": "2024-01-21T12:00:01Z",
  "datacontenttype": "application/json",
  "dataschema": "https://schemas.ocn.ai/events/v1/orion.explanation.v1.schema.json",
  "data": {
    "verification_result": {
      "best_rail": {
        "rail_type": "rtp",
        "score": 0.85,
        "cost": 0.25,
        "speed": "instant",
        "limits": {
          "max_amount": 25000,
          "daily_limit": 100000
        }
      },
      "ranked_rails": [
        {
          "rail_type": "rtp",
          "score": 0.85,
          "cost": 0.25,
          "speed": "instant",
          "limits": {
            "max_amount": 25000,
            "daily_limit": 100000
          }
        },
        {
          "rail_type": "ach",
          "score": 0.72,
          "cost": 0.15,
          "speed": "next_day",
          "limits": {
            "max_amount": 50000,
            "daily_limit": 500000
          }
        },
        {
          "rail_type": "wire",
          "score": 0.65,
          "cost": 2.50,
          "speed": "same_day",
          "limits": {
            "max_amount": 100000,
            "daily_limit": 1000000
          }
        },
        {
          "rail_type": "v_card",
          "score": 0.58,
          "cost": 1.00,
          "speed": "instant",
          "limits": {
            "max_amount": 10000,
            "daily_limit": 25000
          }
        }
      ],
      "explanation": {
        "reason": "RTP selected for optimal balance of speed and cost for moderate amount",
        "signals": [
          {
            "signal": "transaction_amount",
            "value": 15000,
            "impact": "positive",
            "weight": 0.4
          },
          {
            "signal": "speed_requirement",
            "value": "high",
            "impact": "positive",
            "weight": 0.3
          },
          {
            "signal": "cost_sensitivity",
            "value": "medium",
            "impact": "neutral",
            "weight": 0.3
          }
        ],
        "mitigation": [
          "Monitor for failed transactions",
          "Fallback to ACH if RTP unavailable"
        ],
        "confidence": 0.88
      },
      "optimization_id": "opt_12345"
    },
    "context": {
      "amount": 15000,
      "urgency": "high",
      "recipient_country": "US"
    },
    "timestamp": "2024-01-21T12:00:01Z",
    "metadata": {
      "service": "orion",
      "version": "1.0.0",
      "feature": "payout_optimization"
    }
  }
}
